<?xml version="1.0"?>
<!DOCTYPE Report
[
<!ELEMENT Report (General ,(Doc|BPT)) >
<!ATTLIST Report ver CDATA #REQUIRED tmZone CDATA #REQUIRED>

<!ELEMENT General ( DocLocation ) >
<!ATTLIST General productName CDATA #REQUIRED productVer CDATA #REQUIRED os CDATA #REQUIRED host CDATA #REQUIRED qcserver CDATA #IMPLIED qcproject CDATA #IMPLIED SolManSolutionId CDATA #IMPLIED SolManProjectId CDATA #IMPLIED SolManTestPlanId CDATA #IMPLIED SolManTestPackageId CDATA #IMPLIED SolManUserInfoData CDATA #IMPLIED  >

<!ELEMENT BPT (DName,Res,DVer?,TSet?,TInst?,NodeArgs,AdditionalInfo*,Doc*) >
<!ATTLIST BPT rID ID #REQUIRED >

<!ELEMENT Doc (DName,ConfName?,Res,DVer?,TSet?,TInst?,RunType?,DT?,AdditionalInfo*,Step*,DIter*,Step*,Action*,Doc*,Summary?,TestMaintenanceSummary*,NodeArgs?) >
<!ATTLIST Doc rID ID #REQUIRED type (Test|BC|BPTWrapperTest|Flow|Group|Action) "Test" productName CDATA #REQUIRED BCIter CDATA #IMPLIED >

<!ELEMENT RunType ( #PCDATA )>
<!ATTLIST RunType fmStep (False|True) "False" batch (False|True) "False" upDesc (False|True) "False" upChk (False|True) "False" upAS (False|True) "False">

<!ELEMENT DName ( #PCDATA ) >

<!ELEMENT ConfName ( #PCDATA ) >

<!ELEMENT Res ( #PCDATA ) >

<!ELEMENT AdditionalInfo (AdditionalDataName,AdditionalDataValue ) >

<!ELEMENT AdditionalDataName ( #PCDATA ) >

<!ELEMENT AdditionalDataValue ( #PCDATA ) >

<!ELEMENT DVer ( #PCDATA ) >

<!ELEMENT TSet ( #PCDATA ) >

<!ELEMENT TInst ( #PCDATA ) >

<!ELEMENT DIter (Step*,Action+,Summary?,NodeArgs)>
<!ATTLIST DIter rID ID #REQUIRED iterID CDATA #REQUIRED>

<!ELEMENT DocLocation ( #PCDATA )>

<!ELEMENT Action (AName,AIter*,(Step|HtmlStep|Action)*, Summary,ActionMaintenanceSummary*, NodeArgs ) >
<!ATTLIST Action rID ID #REQUIRED>

<!ELEMENT AIter ((Step|HtmlStep|Action)*,DataMapping?, Summary?,NodeArgs) >
<!ATTLIST AIter rID ID #REQUIRED iterID CDATA #REQUIRED isCountable (False|True) "False" >

<!ELEMENT AName ( #PCDATA ) >

<!ELEMENT TestMaintenanceSummary (ActionMaintenanceSummary*) >
<!ATTLIST TestMaintenanceSummary ObjectsAdded CDATA #REQUIRED ObjectsUpdated CDATA #REQUIRED StepsUpdated CDATA #REQUIRED StepsComments CDATA #REQUIRED><!ELEMENT ActionMaintenanceSummary (ObjectChange* ) >
<!ATTLIST ActionMaintenanceSummary Action CDATA #REQUIRED Objects CDATA #REQUIRED Updated CDATA #REQUIRED LinesTotal CDATA #REQUIRED Added CDATA #REQUIRED LinesUpdated CDATA #REQUIRED>

<!ELEMENT ObjectChange  (Hierarchy, PropertyChangeList* ) >
<!ATTLIST ObjectChange Operation CDATA #IMPLIED OriginalRepository CDATA #IMPLIED>

<!ELEMENT PropertyChangeList (PropertyDef*) >

<!ELEMENT PropertyDef (OriginalValue, NewValue) >
<!ATTLIST PropertyDef PropName CDATA #REQUIRED OriginRegularExpression (True|False) "False" NewRegularExpression (True|False) "False" AddedProperty (True|False) "False" >

<!ELEMENT OriginalValue ( #PCDATA )>

<!ELEMENT NewValue ( #PCDATA )>

<!ELEMENT Hierarchy  (ObjectName, Hierarchy*) >
<!ATTLIST Hierarchy MicClass CDATA #REQUIRED>

<!ELEMENT ObjectName  ( #PCDATA ) >

<!ELEMENT Step (Obj,Details,Time,TimeTick* ,(Step|HtmlStep|Doc)*, DataMapping?, NodeArgs) >
<!ATTLIST Step rID ID #REQUIRED retval CDATA #IMPLIED>

<!ELEMENT HtmlStep (HTML,TimeTick*,(Step|HtmlStep|Doc)*,NodeArgs) >
<!ATTLIST HtmlStep rID ID #REQUIRED >

<!ELEMENT Obj ( #PCDATA ) >
<!ATTLIST Obj plainTxt (False|True) "True">

<!ELEMENT Details ( #PCDATA ) >
<!ATTLIST Details plainTxt (False|True) "True">

<!ELEMENT Time ( #PCDATA ) >

<!ELEMENT HTML ( #PCDATA ) >

<!ELEMENT Disp ( #PCDATA ) >

<!ELEMENT TimeTick ( #PCDATA ) >

<!ELEMENT DataMapping ( DataMappedItem* )>
<!ELEMENT DataMappedItem EMPTY >
<!ATTLIST DataMappedItem dsName CDATA #REQUIRED >
<!ATTLIST DataMappedItem rowId CDATA #REQUIRED >

<!ELEMENT NodeArgs (Disp,TopPane?,BtmPane?,ExtendedInfo? )>
<!ATTLIST NodeArgs eType CDATA #REQUIRED icon CDATA #REQUIRED nRep CDATA #REQUIRED UserNote CDATA #IMPLIED filter (False|True) "True">
<!ATTLIST NodeArgs status (Passed|Failed|Done|Warning|Information) "Done">
<!ATTLIST NodeArgs iconSel CDATA #IMPLIED nType CDATA #IMPLIED MovieMarker CDATA "">
<!ATTLIST NodeArgs Source CDATA #IMPLIED SourceLine CDATA #IMPLIED StepFlowItemKey CDATA #IMPLIED >

<!ELEMENT TopPane (Path)>

<!ELEMENT BtmPane ( (Path|WR)?,ASHilite?)>
<!ATTLIST BtmPane vType CDATA "HTML">

<!ELEMENT Path ( #PCDATA ) >

<!ELEMENT ASHilite ( #PCDATA ) >

<!ELEMENT WR ( #PCDATA ) >

<!ELEMENT ExtendedInfo ( StepData ) >

<!ATTLIST ExtendedInfo StepType CDATA #REQUIRED>
<!ELEMENT DT (NodeArgs) >
<!ATTLIST DT rID ID #REQUIRED>

<!ELEMENT Summary (Param*)>
<!ATTLIST Summary sTime CDATA #IMPLIED eTime CDATA #IMPLIED passed CDATA #IMPLIED failed CDATA #IMPLIED warnings CDATA #IMPLIED retval CDATA #IMPLIED stopped (False|True) "False" >

<!ELEMENT Param (ParamName,ParamVal)+ >
<!ATTLIST Param paramInOut (In|Out) "In">

<!ELEMENT ParamName ( #PCDATA ) >

<!ELEMENT ParamVal ( #PCDATA ) >

]
>
<Report ver="2.0" tmZone="India Standard Time">
<General productName="HPE Unified Functional Testing" productVer="14.03" os="" host="LIN33004137"><DocLocation><![CDATA[C:\framework\QTP-Hybrid-Framework\QTP-Hybrid-Framework\TestCases\orangehrm_11]]></DocLocation></General>
<Doc rID="T1"   productName= "HPE Unified Functional Testing"  >
<DName><![CDATA[orangehrm_11]]></DName>
<Res><![CDATA[Res9]]></Res>
<DT rID="T2">
<NodeArgs eType="Table" icon="2" nRep="4" filter="False" >
<Disp><![CDATA[Run-Time Data Table]]></Disp>
<BtmPane vType="Table" >
<Path><![CDATA[Default.xls]]></Path>
</BtmPane>
</NodeArgs>
</DT>
<DIter rID="T3" iterID="1" >
<Action rID="T4">
<AName><![CDATA[Login]]></AName>
<Step rID="T5">
<Obj plainTxt="False" ><![CDATA[OrangeHRM]]></Obj>
<Details plainTxt="False" ><![CDATA[<table><tr><td><span style="text-align : left; font-size : 12px; ">Local Browser</span></td></tr></table>]]></Details>
<Time><![CDATA[14-02-2023 - 12:19:14]]></Time>
<TimeTick>1676357354</TimeTick>
<Step rID="T6">
<Obj plainTxt="False" ><![CDATA[OrangeHRM]]></Obj>
<Details plainTxt="False" ><![CDATA[Page]]></Details>
<Time><![CDATA[14-02-2023 - 12:19:14]]></Time>
<TimeTick>1676357354</TimeTick>
<Step rID="T7">
<Obj plainTxt="False" ><![CDATA[username.Set]]></Obj>
<Details plainTxt="False" ><![CDATA["Admin"]]></Details>
<Time><![CDATA[14-02-2023 - 12:19:14]]></Time>
<TimeTick>1676357354</TimeTick>
<NodeArgs eType="Replay" icon="7" nRep="12" Source="Login" SourceLine="1" >
<Disp><![CDATA[username.Set]]></Disp>
</NodeArgs>
</Step>
<Step rID="T8">
<Obj plainTxt="False" ><![CDATA[password.Set]]></Obj>
<Details plainTxt="False" ><![CDATA["63eb2d5da7b3959dae3c5969ba13413df5b4cf4a242b"]]></Details>
<Time><![CDATA[14-02-2023 - 12:19:14]]></Time>
<TimeTick>1676357354</TimeTick>
<NodeArgs eType="Replay" icon="7" nRep="15" Source="Login" SourceLine="2" >
<Disp><![CDATA[password.Set]]></Disp>
</NodeArgs>
</Step>
<Step rID="T9">
<Obj plainTxt="False" ><![CDATA[Login.Click]]></Obj>
<Details plainTxt="False" ><![CDATA[]]></Details>
<Time><![CDATA[14-02-2023 - 12:19:14]]></Time>
<TimeTick>1676357354</TimeTick>
<NodeArgs eType="Replay" icon="8" nRep="18" Source="Login" SourceLine="3" >
<Disp><![CDATA[Login.Click]]></Disp>
</NodeArgs>
</Step>
<NodeArgs eType="Context" icon="6" nRep="11" Source="Login" SourceLine="1" >
<Disp><![CDATA[OrangeHRM]]></Disp>
</NodeArgs>
</Step>
<NodeArgs eType="Context" icon="5" nRep="10" Source="Login" SourceLine="1" >
<Disp><![CDATA[OrangeHRM]]></Disp>
</NodeArgs>
</Step>
<Summary sTime="14-02-2023 - 12:19:14" eTime="14-02-2023 - 12:19:14" passed="0" failed="0" warnings="0" ></Summary>
<NodeArgs eType="StartAction" icon="4" nRep="7" >
<Disp><![CDATA[Login Summary]]></Disp>
</NodeArgs>
</Action>
<Action rID="T10">
<AName><![CDATA[pim]]></AName>
<Step rID="T11">
<Obj plainTxt="False" ><![CDATA[OrangeHRM]]></Obj>
<Details plainTxt="False" ><![CDATA[<table><tr><td><span style="text-align : left; font-size : 12px; ">Local Browser</span></td></tr></table>]]></Details>
<Time><![CDATA[14-02-2023 - 12:19:16]]></Time>
<TimeTick>1676357356</TimeTick>
<Step rID="T12">
<Obj plainTxt="False" ><![CDATA[OrangeHRM]]></Obj>
<Details plainTxt="False" ><![CDATA[Page]]></Details>
<Time><![CDATA[14-02-2023 - 12:19:16]]></Time>
<TimeTick>1676357356</TimeTick>
<Step rID="T13">
<Obj plainTxt="False" ><![CDATA[PIM.Click]]></Obj>
<Details plainTxt="False" ><![CDATA[]]></Details>
<Time><![CDATA[14-02-2023 - 12:19:16]]></Time>
<TimeTick>1676357356</TimeTick>
<NodeArgs eType="Replay" icon="9" nRep="25" Source="pim" SourceLine="0" >
<Disp><![CDATA[PIM.Click]]></Disp>
</NodeArgs>
</Step>
<NodeArgs eType="Context" icon="6" nRep="24" Source="pim" SourceLine="0" >
<Disp><![CDATA[OrangeHRM]]></Disp>
</NodeArgs>
</Step>
<Step rID="T14">
<Obj plainTxt="False" ><![CDATA[OrangeHRM_2]]></Obj>
<Details plainTxt="False" ><![CDATA[Page]]></Details>
<Time><![CDATA[14-02-2023 - 12:19:18]]></Time>
<TimeTick>1676357358</TimeTick>
<Step rID="T15">
<Obj plainTxt="False" ><![CDATA[Type for hints....Set]]></Obj>
<Details plainTxt="False" ><![CDATA["bhargavi"]]></Details>
<Time><![CDATA[14-02-2023 - 12:19:18]]></Time>
<TimeTick>1676357358</TimeTick>
<NodeArgs eType="Replay" icon="7" nRep="29" Source="pim" SourceLine="1" >
<Disp><![CDATA[Type for hints....Set]]></Disp>
</NodeArgs>
</Step>
<Step rID="T16">
<Obj plainTxt="False" ><![CDATA[Search.Click]]></Obj>
<Details plainTxt="False" ><![CDATA[]]></Details>
<Time><![CDATA[14-02-2023 - 12:19:18]]></Time>
<TimeTick>1676357358</TimeTick>
<NodeArgs eType="Replay" icon="8" nRep="32" Source="pim" SourceLine="2" >
<Disp><![CDATA[Search.Click]]></Disp>
</NodeArgs>
</Step>
<Step rID="T17">
<Obj plainTxt="False" ><![CDATA[Type for hints....Set]]></Obj>
<Details plainTxt="False" ><![CDATA["madhu"]]></Details>
<Time><![CDATA[14-02-2023 - 12:19:18]]></Time>
<TimeTick>1676357358</TimeTick>
<NodeArgs eType="Replay" icon="7" nRep="35" Source="pim" SourceLine="3" >
<Disp><![CDATA[Type for hints....Set]]></Disp>
</NodeArgs>
</Step>
<Step rID="T18">
<Obj plainTxt="False" ><![CDATA[Search.Click]]></Obj>
<Details plainTxt="False" ><![CDATA[]]></Details>
<Time><![CDATA[14-02-2023 - 12:19:18]]></Time>
<TimeTick>1676357358</TimeTick>
<NodeArgs eType="Replay" icon="8" nRep="38" Source="pim" SourceLine="4" >
<Disp><![CDATA[Search.Click]]></Disp>
</NodeArgs>
</Step>
<Step rID="T19">
<Obj plainTxt="False" ><![CDATA[Add.Click]]></Obj>
<Details plainTxt="False" ><![CDATA[]]></Details>
<Time><![CDATA[14-02-2023 - 12:19:18]]></Time>
<TimeTick>1676357358</TimeTick>
<NodeArgs eType="Replay" icon="8" nRep="41" Source="pim" SourceLine="5" >
<Disp><![CDATA[Add.Click]]></Disp>
</NodeArgs>
</Step>
<NodeArgs eType="Context" icon="6" nRep="28" Source="pim" SourceLine="1" >
<Disp><![CDATA[OrangeHRM_2]]></Disp>
</NodeArgs>
</Step>
<Step rID="T20">
<Obj plainTxt="False" ><![CDATA[OrangeHRM_3]]></Obj>
<Details plainTxt="False" ><![CDATA[Page]]></Details>
<Time><![CDATA[14-02-2023 - 12:19:20]]></Time>
<TimeTick>1676357360</TimeTick>
<Step rID="T21">
<Obj plainTxt="False" ><![CDATA[firstName.Set]]></Obj>
<Details plainTxt="False" ><![CDATA["madhu"]]></Details>
<Time><![CDATA[14-02-2023 - 12:19:20]]></Time>
<TimeTick>1676357360</TimeTick>
<NodeArgs eType="Replay" icon="7" nRep="46" Source="pim" SourceLine="6" >
<Disp><![CDATA[firstName.Set]]></Disp>
</NodeArgs>
</Step>
<Step rID="T22">
<Obj plainTxt="False" ><![CDATA[middleName.Set]]></Obj>
<Details plainTxt="False" ><![CDATA["sudhan"]]></Details>
<Time><![CDATA[14-02-2023 - 12:19:20]]></Time>
<TimeTick>1676357360</TimeTick>
<NodeArgs eType="Replay" icon="7" nRep="49" Source="pim" SourceLine="7" >
<Disp><![CDATA[middleName.Set]]></Disp>
</NodeArgs>
</Step>
<Step rID="T23">
<Obj plainTxt="False" ><![CDATA[lastName.Set]]></Obj>
<Details plainTxt="False" ><![CDATA["mamidela"]]></Details>
<Time><![CDATA[14-02-2023 - 12:19:20]]></Time>
<TimeTick>1676357360</TimeTick>
<NodeArgs eType="Replay" icon="7" nRep="52" Source="pim" SourceLine="8" >
<Disp><![CDATA[lastName.Set]]></Disp>
</NodeArgs>
</Step>
<Step rID="T24">
<Obj plainTxt="False" ><![CDATA["Employee Id"- Smart Identification]]></Obj>
<Details plainTxt="False" ><![CDATA[<P><span class="text">The smart identification mechanism was invoked.</span></P><P><SPAN class=text>Reason: object not unique (4 objects found)</SPAN></P>           <SPAN class=text><b>Original description:</b></SPAN><br>micclass=WebElement<br>innertext=Employee Id<br>html tag=DIV<br>acc_name=<br><P><FONT face=Verdana size=2><SPAN class=text><B>Smart Identification Alternative Description: </B></SPAN></FONT></P><FONT face=Verdana size=2><u>Base filter properties (54 objects found)&nbsp;</FONT></u><br>
micclass=WebElement<br>html tag=DIV<br><br><FONT face=Verdana size=2><u>Optional filter properties</FONT></u><br>
html id=<SPAN class=passed> (Used</SPAN>, 52 matches)</SPAN><br>class=oxd-grid-item oxd-grid-item--gutters<SPAN class=passed> (Used</SPAN>, 2 matches)</SPAN><br>innertext=Employee Id<SPAN class=passed> (Used</SPAN>, 1 matches)</SPAN><br>visible=-1<SPAN class=warning> (Ignored)<FONT color=#000000></FONT></SPAN><br>acc_name=<SPAN class=warning> (Ignored)<FONT color=#000000></FONT></SPAN><br>]]></Details>
<Time><![CDATA[14-02-2023 - 12:19:20]]></Time>
<TimeTick>1676357360</TimeTick>
<NodeArgs eType="Replay" icon="10" nRep="55" Source="pim" SourceLine="9" >
<Disp><![CDATA["Employee Id"- Smart Identification]]></Disp>
</NodeArgs>
</Step>
<Step rID="T25">
<Obj plainTxt="False" ><![CDATA[Employee Id.Click]]></Obj>
<Details plainTxt="False" ><![CDATA[]]></Details>
<Time><![CDATA[14-02-2023 - 12:19:20]]></Time>
<TimeTick>1676357360</TimeTick>
<NodeArgs eType="Replay" icon="11" nRep="56" Source="pim" SourceLine="9" >
<Disp><![CDATA[Employee Id.Click]]></Disp>
</NodeArgs>
</Step>
<Step rID="T26">
<Obj plainTxt="False" ><![CDATA[WebEdit.Set]]></Obj>
<Details plainTxt="False" ><![CDATA["029378"]]></Details>
<Time><![CDATA[14-02-2023 - 12:19:20]]></Time>
<TimeTick>1676357360</TimeTick>
<NodeArgs eType="Replay" icon="7" nRep="59" Source="pim" SourceLine="10" >
<Disp><![CDATA[WebEdit.Set]]></Disp>
</NodeArgs>
</Step>
<Step rID="T27">
<Obj plainTxt="False" ><![CDATA[Save.Click]]></Obj>
<Details plainTxt="False" ><![CDATA[]]></Details>
<Time><![CDATA[14-02-2023 - 12:19:20]]></Time>
<TimeTick>1676357360</TimeTick>
<NodeArgs eType="Replay" icon="8" nRep="62" Source="pim" SourceLine="11" >
<Disp><![CDATA[Save.Click]]></Disp>
</NodeArgs>
</Step>
<NodeArgs eType="Context" icon="6" nRep="45" Source="pim" SourceLine="6" >
<Disp><![CDATA[OrangeHRM_3]]></Disp>
</NodeArgs>
</Step>
<Step rID="T28">
<Obj plainTxt="False" ><![CDATA[OrangeHRM_4]]></Obj>
<Details plainTxt="False" ><![CDATA[Page]]></Details>
<Time><![CDATA[14-02-2023 - 12:19:21]]></Time>
<TimeTick>1676357361</TimeTick>
<Step rID="T29">
<Obj plainTxt="False" ><![CDATA[Save.Click]]></Obj>
<Details plainTxt="False" ><![CDATA[]]></Details>
<Time><![CDATA[14-02-2023 - 12:19:21]]></Time>
<TimeTick>1676357361</TimeTick>
<NodeArgs eType="Replay" icon="8" nRep="66" Source="pim" SourceLine="12" >
<Disp><![CDATA[Save.Click]]></Disp>
</NodeArgs>
</Step>
<Step rID="T30">
<Obj plainTxt="False" ><![CDATA[Save_2.Click]]></Obj>
<Details plainTxt="False" ><![CDATA[]]></Details>
<Time><![CDATA[14-02-2023 - 12:19:21]]></Time>
<TimeTick>1676357361</TimeTick>
<NodeArgs eType="Replay" icon="8" nRep="69" Source="pim" SourceLine="13" >
<Disp><![CDATA[Save_2.Click]]></Disp>
</NodeArgs>
</Step>
<Step rID="T31">
<Obj plainTxt="False" ><![CDATA[PIM.Click]]></Obj>
<Details plainTxt="False" ><![CDATA[]]></Details>
<Time><![CDATA[14-02-2023 - 12:19:21]]></Time>
<TimeTick>1676357361</TimeTick>
<NodeArgs eType="Replay" icon="9" nRep="72" Source="pim" SourceLine="14" >
<Disp><![CDATA[PIM.Click]]></Disp>
</NodeArgs>
</Step>
<NodeArgs eType="Context" icon="6" nRep="65" Source="pim" SourceLine="12" >
<Disp><![CDATA[OrangeHRM_4]]></Disp>
</NodeArgs>
</Step>
<Step rID="T32">
<Obj plainTxt="False" ><![CDATA[OrangeHRM_2]]></Obj>
<Details plainTxt="False" ><![CDATA[Page]]></Details>
<Time><![CDATA[14-02-2023 - 12:19:23]]></Time>
<TimeTick>1676357363</TimeTick>
<Step rID="T33">
<Obj plainTxt="False" ><![CDATA[Type for hints....Set]]></Obj>
<Details plainTxt="False" ><![CDATA["madhu"]]></Details>
<Time><![CDATA[14-02-2023 - 12:19:23]]></Time>
<TimeTick>1676357363</TimeTick>
<NodeArgs eType="Replay" icon="7" nRep="77" Source="pim" SourceLine="15" >
<Disp><![CDATA[Type for hints....Set]]></Disp>
</NodeArgs>
</Step>
<Step rID="T34">
<Obj plainTxt="False" ><![CDATA[Search.Click]]></Obj>
<Details plainTxt="False" ><![CDATA[]]></Details>
<Time><![CDATA[14-02-2023 - 12:19:23]]></Time>
<TimeTick>1676357363</TimeTick>
<NodeArgs eType="Replay" icon="8" nRep="80" Source="pim" SourceLine="16" >
<Disp><![CDATA[Search.Click]]></Disp>
</NodeArgs>
</Step>
<Step rID="T35">
<Obj plainTxt="False" ><![CDATA[WebCheckBox.Set]]></Obj>
<Details plainTxt="False" ><![CDATA["ON"]]></Details>
<Time><![CDATA[14-02-2023 - 12:19:24]]></Time>
<TimeTick>1676357364</TimeTick>
<NodeArgs eType="Replay" icon="12" nRep="84" Source="pim" SourceLine="17" >
<Disp><![CDATA[WebCheckBox.Set]]></Disp>
</NodeArgs>
</Step>
<Step rID="T36">
<Obj plainTxt="False" ><![CDATA[Delete Selected.Click]]></Obj>
<Details plainTxt="False" ><![CDATA[]]></Details>
<Time><![CDATA[14-02-2023 - 12:19:24]]></Time>
<TimeTick>1676357364</TimeTick>
<NodeArgs eType="Replay" icon="8" nRep="87" Source="pim" SourceLine="18" >
<Disp><![CDATA[Delete Selected.Click]]></Disp>
</NodeArgs>
</Step>
<Step rID="T37">
<Obj plainTxt="False" ><![CDATA[Yes, Delete.Click]]></Obj>
<Details plainTxt="False" ><![CDATA[]]></Details>
<Time><![CDATA[14-02-2023 - 12:19:24]]></Time>
<TimeTick>1676357364</TimeTick>
<NodeArgs eType="Replay" icon="8" nRep="90" Source="pim" SourceLine="19" >
<Disp><![CDATA[Yes, Delete.Click]]></Disp>
</NodeArgs>
</Step>
<NodeArgs eType="Context" icon="6" nRep="76" Source="pim" SourceLine="15" >
<Disp><![CDATA[OrangeHRM_2]]></Disp>
</NodeArgs>
</Step>
<NodeArgs eType="Context" icon="5" nRep="23" Source="pim" SourceLine="0" >
<Disp><![CDATA[OrangeHRM]]></Disp>
</NodeArgs>
</Step>
<Summary sTime="14-02-2023 - 12:19:14" eTime="14-02-2023 - 12:19:24" passed="0" failed="0" warnings="0" ></Summary>
<NodeArgs eType="StartAction" icon="4" nRep="20" >
<Disp><![CDATA[pim Summary]]></Disp>
</NodeArgs>
</Action>
<Action rID="T38">
<AName><![CDATA[myingo]]></AName>
<Step rID="T39">
<Obj plainTxt="False" ><![CDATA[OrangeHRM]]></Obj>
<Details plainTxt="False" ><![CDATA[<table><tr><td><span style="text-align : left; font-size : 12px; ">Local Browser</span></td></tr></table>]]></Details>
<Time><![CDATA[14-02-2023 - 12:19:24]]></Time>
<TimeTick>1676357364</TimeTick>
<Step rID="T40">
<Obj plainTxt="False" ><![CDATA[OrangeHRM]]></Obj>
<Details plainTxt="False" ><![CDATA[Page]]></Details>
<Time><![CDATA[14-02-2023 - 12:19:24]]></Time>
<TimeTick>1676357364</TimeTick>
<Step rID="T41">
<Obj plainTxt="False" ><![CDATA[My Info.Click]]></Obj>
<Details plainTxt="False" ><![CDATA[]]></Details>
<Time><![CDATA[14-02-2023 - 12:19:24]]></Time>
<TimeTick>1676357364</TimeTick>
<NodeArgs eType="Replay" icon="9" nRep="97" Source="myingo" SourceLine="0" >
<Disp><![CDATA[My Info.Click]]></Disp>
</NodeArgs>
</Step>
<Step rID="T42">
<Obj plainTxt="False" ><![CDATA[My Info.Click]]></Obj>
<Details plainTxt="False" ><![CDATA[]]></Details>
<Time><![CDATA[14-02-2023 - 12:19:26]]></Time>
<TimeTick>1676357366</TimeTick>
<NodeArgs eType="Replay" icon="9" nRep="100" Source="myingo" SourceLine="1" >
<Disp><![CDATA[My Info.Click]]></Disp>
</NodeArgs>
</Step>
<Step rID="T43">
<Obj plainTxt="False" ><![CDATA[Save.Click]]></Obj>
<Details plainTxt="False" ><![CDATA[]]></Details>
<Time><![CDATA[14-02-2023 - 12:19:28]]></Time>
<TimeTick>1676357368</TimeTick>
<NodeArgs eType="Replay" icon="8" nRep="103" Source="myingo" SourceLine="2" >
<Disp><![CDATA[Save.Click]]></Disp>
</NodeArgs>
</Step>
<Step rID="T44">
<Obj plainTxt="False" ><![CDATA[Save_2.Click]]></Obj>
<Details plainTxt="False" ><![CDATA[]]></Details>
<Time><![CDATA[14-02-2023 - 12:19:28]]></Time>
<TimeTick>1676357368</TimeTick>
<NodeArgs eType="Replay" icon="8" nRep="106" Source="myingo" SourceLine="3" >
<Disp><![CDATA[Save_2.Click]]></Disp>
</NodeArgs>
</Step>
<Step rID="T45">
<Obj plainTxt="False" ><![CDATA[vishal Bhattaraimohan.Click]]></Obj>
<Details plainTxt="False" ><![CDATA[]]></Details>
<Time><![CDATA[14-02-2023 - 12:19:28]]></Time>
<TimeTick>1676357368</TimeTick>
<NodeArgs eType="Replay" icon="11" nRep="109" Source="myingo" SourceLine="4" >
<Disp><![CDATA[vishal Bhattaraimohan.Click]]></Disp>
</NodeArgs>
</Step>
<Step rID="T46">
<Obj plainTxt="False" ><![CDATA[About Support Change Password.Select]]></Obj>
<Details plainTxt="False" ><![CDATA["Logout"]]></Details>
<Time><![CDATA[14-02-2023 - 12:19:29]]></Time>
<TimeTick>1676357369</TimeTick>
<NodeArgs eType="Replay" icon="13" nRep="112" Source="myingo" SourceLine="5" >
<Disp><![CDATA[About Support Change Password.Select]]></Disp>
</NodeArgs>
</Step>
<NodeArgs eType="Context" icon="6" nRep="96" Source="myingo" SourceLine="0" >
<Disp><![CDATA[OrangeHRM]]></Disp>
</NodeArgs>
</Step>
<NodeArgs eType="Context" icon="5" nRep="95" Source="myingo" SourceLine="0" >
<Disp><![CDATA[OrangeHRM]]></Disp>
</NodeArgs>
</Step>
<Summary sTime="14-02-2023 - 12:19:24" eTime="14-02-2023 - 12:19:29" passed="0" failed="0" warnings="0" ></Summary>
<NodeArgs eType="StartAction" icon="4" nRep="92" >
<Disp><![CDATA[myingo Summary]]></Disp>
</NodeArgs>
</Action>
<NodeArgs eType="StartIteration" icon="3" nRep="6" >
<Disp><![CDATA[orangehrm_11 Iteration 1 (Row 1)]]></Disp>
</NodeArgs>
</DIter>
<Summary sTime="14-02-2023 - 12:19:08" eTime="14-02-2023 - 12:19:29" passed="0" failed="0" warnings="0" ></Summary>
<NodeArgs eType="StartTest" icon="1" nRep="3" >
<Disp><![CDATA[Test orangehrm_11 Summary]]></Disp>
</NodeArgs>
</Doc>
</Report>